{
  "lake_id": "imja-tsho",
  "variable": "lake_area",
  "measurement_family": "optical",
  "value": 1.34024,
  "unit": "km2",
  "observed_at": "2025-11-17T05:01:00.426000Z",
  "processed_at": "2026-08-28T03:14:46.592914Z",
  "source": "Sentinel-2",
  "source_product": "COPERNICUS/S2_SR_HARMONIZED/20251117T044959_20251117T045240_T45RVL",
  "source_url": "https://developers.google.com/earth-engine/datasets/catalog/COPERNICUS_S2_SR_HARMONIZED",
  "method": "sentinel2_s2sr_qa60_scl_ndwi_connected_component",
  "method_version": "0.1.0",
  "parameters": {
    "index": "NDWI=(B3-B8)/(B3+B8)",
    "ndwi_threshold": 0.1,
    "cloud_mask": "QA60 cloud/cirrus bits plus SCL cloud-shadow/snow classes",
    "aoi_status": "draft_requires_visual_validation"
  },
  "confidence": null,
  "quality_flags": [
    "QA_PASSED_PENDING_REVIEW"
  ],
  "observation_state": "processed",
  "rejection_reasons": [],
  "state_history": [
    {
      "state": "discovered",
      "at": "2026-08-28T03:14:46.592914Z"
    },
    {
      "state": "processed",
      "at": "2026-08-28T03:14:46.592914Z"
    }
  ],
  "freshness": {
    "status": "HISTORICAL",
    "age_days": 283,
    "evaluated_at": "2026-08-28T03:14:46.592914Z"
  },
  "boundary_geojson_url": "data/processed/imja-tsho/scenes/20251117T044959_20251117T045240_T45RVL.geojson",
  "qa": {
    "aoi_valid_fraction": 0.6029874558914119,
    "lake_envelope_valid_fraction": 1.0,
    "reference_lake_envelope_path": "data/processed/imja-tsho/boundaries/2025-11-17_20251117T044959_20251117T045240_T45RVL.geojson",
    "outlier_reference_observation": null,
    "relative_area_change": null
  },
  "provenance": {
    "code_version": "scan_sentinel2_v0_1",
    "config_path": "config/lakes/imja-tsho.json",
    "image_id": "COPERNICUS/S2_SR_HARMONIZED/20251117T044959_20251117T045240_T45RVL",
    "earth_engine_collection": "COPERNICUS/S2_SR_HARMONIZED",
    "scene_cloud_cover_percent": 0.376329,
    "aoi_valid_fraction": 0.6029874558914119
  }
}
